uuid,title,description
6601ab2538f4323b8e49851f4b7cfe50,Head Pastry Chef [5.5 Days / MacPherson] 9156,"Head Pastry ChefSalary: $3,000 to $3,500 (can nego)Location: Macpherson Road (368215)5.5 days alt week (Alternate 1 day and 2 days off per week)Working hours: Discuss during interviewJob Scope:  Assist in developing and implementing new menu  Ensure the consistency and high quality of all products across the outlets  Responsible  for cleanliness of all areas and aspects of the kitchen, food storage  areas, including proper rotation of all ingredients to prevent food  waste  Ensure that all recipes, food preparations, and presentations meet the standard procedures and guidelines.  Ensure all SOPs are up to date  Ensure delivery schedule and timely order processing  Minimize the wastage and spoilage of ingredients and other food items  Training and development of staff  Managing of staff  Ensure all equipment is in full working order, safe to operate, and well maintained  Other ad-hoc duties as requestedRequirements:  Min. 2 years experience managing a pastry kitchen team📲Whatsapp 9851 1096 📩supreme.cherlylim@gmail.com  R2199156 14C7279"
357657f1bdce1db1ecdccf357b4cc039,Software Engineer【.NET Developer/ 5 days/ Level 3 Support】-7912,"Job Description  Write clean , scalable code using .NET technologies  Remain up to date with terminology , concepts and best practices  Use and adapt existing web applications / projects  Create software prototypes for POC  Assisting demos with sales teams  Develop client displays and user interfaces  Provide level 3 support  Diagnose  resolve application/configuration/code level technical issues  Maintain up-to-date required technical documentation and log support activityRequirements:  Bachelor’s Degree or equivalent experience required  3+ years of professional development experiences as a .Net developer with browserbased Web applications  Excellent experience with C#, .Net, ASP.NET MVC, WebAPI, JavaScript, SQL Server  Proficient in modern web front end development using JQuery/Angular or React framework  Proven experience in creating responsive web sites using Bootstrap framework  Strong understanding of UIX, cross-browser compatibility, general web functions and standards  Good working experience in IIS, Enterprise Library and T-SQL Stored Procedures.  Good use of HTML5, CSS3, JavaScript, SASS  Basic knowledge of SDLC methodology  Strong analytical and product management skills required  Excellent verbal and written communication skills  Ability to interact professionally with a diverse group, managers, subject matter experts and technical teamsIf you are interested to apply, kindly WhatsApp me your updated resume in DOC file and allow our Consultant to match you with our Clients.Whatsapp: +65 8778 3126 （Nicole Tan）Email: nicole_tan@thesupremehr.com"
c9af90cccf8328052942444817bdaa96,Finance Intern,"ERGO is the primary insurance arm of Munich Re Group, one of the world’s leading risk carriers. ERGO is one of the major insurance groups in Germany and Europe. Worldwide, it is represented in 30 countries and concentrates on Europe and Asia.ERGO Insurance Pte Ltd is ERGO Group’s subsidiary in Singapore.www.ergo.com.sgWe are looking for a highly-motivated individual to join us as a Intern, Finance (January 2022 - Jun 2022, Full-Time or Part-Time min 3 days a week).To be successful in this role, you will possess the following experience, knowledge and skills:Requirements  Undergoing an undergraduate degree in accounting / actuarial science / computer scienceJob descriptionThe successful applicant will:  Assist with building database for Finance using MS Access  Assist with implementing daily system audit file from core system to financial system  Assist with building VBA for reconciliation worksheets  Any other ad hoc duties as may be assignedContactcareer@ergo.com.sg"
68ddaa2c9f4c3a04f2226f2afd213fad,Order Management Manager,"General scope of work:The role will be an integral role in setting up the Order Management team in Singapore with the primary duties of booking forecast, pipeline management, order booking support and coordination with the China IBD for shipment activities*.Job responsibilities:· Oversee all customer order management, billing, and entitlements processes with a focus on delivering superior customer service while meeting customer billing requirements and company billing deadlines.· Collaborate and work closely with the Pricing team and China IBD team in monitoring performance metrics, implementing new tools and technology, and ensuring department can meet changing business requirements· Coordinate with China IBD for shipment activities and commitments· Maintain agile environment and re-prioritize workload of staff to balance expected daily processing workloads, system and data issue remediation, customer issue remediation, and strategic improvement projects· Lead monthly closing processes and provide customers’ monthly unbilled revenue information as required by terms of the contract.· Develop, monitor, and enforce controls to ensure billing information is accurate, timely, and of the highest quality.· Help the pricing team in providing mix data for better pricing and discount approval process· Work with supply chain team for the right shipping instructions and documentations are maintained following customs/VATJob requirements:· At least 8 years relevant order management/ order fulfillment/ logistics related experience, ideally with 3 years of experience in international business.· Significant experience with best-in-class ERP, CRM, and order management systems – JDE and/or others.· Proven Leadership and Management experience with Order Management Programs.· Strong quantitative, analytical, and critical thinking skills with demonstrated use of data analysis and metrics to drive decision making and continuous improvement.· Strong communication skills, ability to be firm and precise and concurrently build effective relationships.· Proven ability to influence cross-functional teams and peers through leading by influence instead of authority"
6748660eb807fdc7e8f604ac0adbc342,Public Health Analyst Trainee,"Traineeship Description: The trainee will have the opportunity to work with experienced Public Health Managers  Consultants to support the design, development and delivery of consulting projects to our clients in the healthcare industry, mainly global health donor organizations and governments. Assignments range in complexity from evaluating and scoping opportunities, research analysis and problem solving to assisting the development of recommendations and presenting them for clients. Depending on the nature of tasks, you may work closely with other business units including the Consulting, Primary Intelligence, Real World Insights, Data and Technology Solutions teams.Specific Responsibilities:   Assist with business development (e.g. opportunities identification and scoping) and proposal writing for untapped public health segments:  Conducting primary and secondary research, and performing quantitative and qualitative analyses to identify client issues and develop client recommendations  Support Public Health project delivery: Creating reports, presentations and other client deliverables, and supporting client meetings and workshops  Support Strategy Development: Developing strategies and evaluating opportunities for global health donor organizations, life science companies, and governments in developing Asia markets Technical Skills and Competencies:  Develop intermediate level of knowledge in one or few of these areas: healthcare, health economics, public health, public policy, epidemiology, life sciences  Understand who are the main global health organisations (e.g. donor/funding agencies, NGOs), governments (e.g. policymakers, regulators) and life science companies  Good degree of comfort with handling data sets (qualitative  quantitative), finding insights in unstructured data, and rapidly evolving project focus / tasks  Develop strong written and verbal communication skills  Develop strong interpersonal skills for working in teams and within the organization  Develop strong problem solving, analytical  project management skills"
b55c7ac4424b4fdbb47914f6d6803d60,Facility Services Specialist,"Calling All Talented Individuals!The Privé Group wants YOU.As one of the leading lifestyle’s operators in Singapore, The Privé Group is looking for dynamic talents for our existing and upcoming projects.We’ve got an eye out for those who actively endorse our vision and who will become champions for delivering the ultimate guest experience. A rich career path awaits those who are willing to devote their time and energy towards creating a rewarding environment for all.If you are passionate about the food and beverage industry and are serious about advancing your career (while having a bit of fun), we would love to hear from you.Job Responsibilities  Provide high standard of hygiene and cleanliness of the outlet  Emptying waste bins  Sweeping and mopping of floors  Cleaning of toilets and replenishing supplies such as toilet paper  Has good organisational skills and the ability to prioritise  Follow all health and safety regulations  Perform additional duties as neededJoin our growing team of experienced and enthusiastic talents  5 Days’ Work Week  Competitive Salary  Performance Incentives  Training  Development Programmes  Career Progression  Integrated Healthcare Benefits  Medical Insurance  Welfare Support (Night Transportation, Staff Meal)  Staff Discounts  Annual Leaves  Birthday Leave  Benefit  Public Holiday Benefit  Long Term Service Rewards"
df0f031c161c717af84b0994ada504ab,Assistant Engineer,"Job Description  Create  update BOM using ERP software.  Create, update  Close Production order using ERP software.  Prepare technical drawings  Work Instructions for Production technicians.  Follow up with Suppliers  Purchasing department on material deliveries.  Support Manufacturing Engineers on ad-hoc tasks.Requirements  Diploma or Higher NITEC in Mechatronics or equivalent with relevant working experience  Computer literate and experience with MS Office, Excel  Strong analytical, communication, and computer skills.  Able to work Independent, self-motivated, highly resourceful and organized  Observant  fast learner.  Experienced in technical drawings"
bbf210c1bd1d7ad670df336e575d2fa3,Branch Banking Sales Executives/ MNC/ Paid Training Provided,"• Amazing opportunity to work in world-class bank• Basic From $3000 to $3800 + Attractive Incentives• No experience needed, paid training will be provided• Fast track progression in Banking and Finance industryResponsibilities:• Work closely with team to managing clients’ portfolio, perform financial analysis• Follow on existing list of clients provided by the company• Maintain customer loyalty and promote brand identity by providing excellent customer service through regular updates and reviews with customers on financial services/information• Assisting in wealth preservation and capital growth• Attend to the walk-in and queuing customers and customize solutions to meet clients’ financial objectivesRequirements:•Degree in any discipline•Good communication skills, strong customer service mindset• Keen interests in Banking and Finance industry• Be pro-active, a good listener, people and results-oriented• Willingness to learn as comprehensive training providedAttractive Salary Package up to $$3800 Basic + Incentives + Commission + Quarterly Bonus + Full Employment Benefits + Fast-track Progressions in Bank!For Fast Response, please Email your updated resume in MS word format with the following details to louise@starrecruitment.com.sg1) Last Drawn Salary2) Expected Salary3) Recent Photo4) Reason(s) for Leaving5) Availability Period6) ReferencesLouise Chia Chau LuRegistration No: R1769464EA License No: 08C5257"
0c48a0db7fed0d3cc169a81fbd4e4f19,Software Engineer [5 days| Pasir Panjang] 2894,Singapore Based  Attractive Salary Package  Company Benefits  Incentives  Career Progression OpportunitiesInterested applicants can also send your resume to 📲Whatsapp：+65 9460 8816https://api.whatsapp.com/send?phone=6594608816✉️Email: supreme.brandonlim@gmail.comand allow our Consultant to match you with our Clients.
15da0389e41974de997a2d813f324ff4,Regional Digital Marketing Director,"MAIN PURPOSELead the digital marketing and media strategy in Shiseido APAC. The individual will be a key contributor towards the digital transformation pillar of the three year strategy of Shiseido APACKEY RESPONSIBILITIES1. Lead Regional Center of Excellence in Digital marketing and Media, providing subject matter expertise to local and regional brand teams, Ecom and CRM teams :o Set the regional Strategy and Vision for digital marketing and media for Shiseido APAC based on regional business strategy and consumer insights for each brando Work with both local and regional brand teams to co-create annual local media investment/ allocation (between channels and between always on vs. campaign) strategies and execution planso Proactively advise local and regional brand teams, and regional Ecom and CRM team on data-driven marketing and sales across whole digital ecosystem – media (paid, owned, earned), CRM and Ecom, review media plans of always on investment as well as major campaigns across all media channelso Compile regional framework/ playbook on how to do data-driven marketing as above  and investment guidelines on paid, owned and earned media for each brando Together with CMI Leader and brand teams - identify emerging media consumption and consumer engagement trends, share learnings and recommend actions on media execution to local markets based on thiso Ensure continuous improvement on media ROAS across all channelso Lead capability building in the area – run regional training /publish playbooks and share best practices (from other Shiseido regions, external as well as amongst SAPAC markets)2. Build and manage partnership in media:o Leader from Shiseido APAC side with regional counterparts of regional media agency group and leading tech ecosystems – e.g FB, Google, Tiktok – establishing Joint Business Plans with themo Build media agencies evaluation and performance management criteria framework, and cascade to local markets, and support local markets with media agencies pitching, work scoping and evaluation process3. Regional Ownership of Digital Marketing and Media Data  Analytics:o Build integrated dashboard/ framework that measures KPIs in sufficiency, efficiency and effectiveness of:§ Paid – e.g. Search, Ecom, Social network platforms, Youtube, beauty publishers, influencers etc.§ Owned – e.g. Websites§ Earned – e.g. social buzz (leveraging KOL tracking and social listening tools)o Build and issue basic performance dashboard for different levels of audience (local/ regional working/ management teams)o Build advanced analytics framework/ playbook (for data-driven media optimization) and run ad-hoc advanced analytics (e.g. MMM and other forms of media attribution and predictive modelling) for each market and for regional brand teamso Advise local markets on KPI target setting in mediao Continuously optimize cost effective execution model –together with IT team and Digital Technology Office, evaluate and select right analytics agencies and the right data tools for each local market; propose in-housing options where makes senseo Work with APAC IT team to ensure data integrity/ cleanliness at all time and problem solve whenever there are data gaps identified4. Project leadership of regional digital marketing and media projects, examples include:o Building Local Brand social accounts – strategy, content requirement and content update/ management framework5. Promote Innovation and support local test and learn:o Be up to date with latest media products offered by the tech ecosystems and retailerso Scout for emerging/ new capabilities in the market that are suitable to implement for Shiseido APAC and suggest piloting roadmap for local markets, and support selected local markets on these pilotsKEY STAKEHOLDERSLocal Teams: Brand teams, Ecom  CRM teamsRegional teams: Brand teams, CMI, ITGlobal teams: Digital Tech Office (DTO), Other region digital offices, brand holders’ teamsREQUIREMENTS· At least 8 years of experience in Media, with at least 2 years in a managerial position in media agencies as well as following industries preferred (in descending order of preference): Luxury brands (beauty, fashion), other FMCG industries, Travel  hospitality· APAC experience preferred· Understanding of consumer decision journey (CDJ) and customer experience along journey· Data-driven mindset and strong analytical skills, with experience in using advanced analytics methodologies (e.g. MMM) and DMP (data management platform) and consumer research/insights to elevate media performance· Working knowledge (experience on how to leverage functionalities) of following technologies:- Media integration modules in Salesforce Marketing Cloud / Commerce Cloud (Preferred but similar enterprise technologies such as Adobe also applicable)- Strong knowledge of Google, FB and Tiktok ecosystem, including backend platforms e.g. FB Business Manager, Google KeyWord Planner- Knowledge of Kakao, Naver Zalo and Line ecosystem preferred- Strong knowledge of media products and respective buying model of Lazada and Shopee· Very strong influencing skills – with proven success in influencing stakeholders (Local and/ or regional) to endorse and invest on media across consumer funnel (upper to lower)· Project management skills on multi-market projects· Team player, with experience working with key stakeholders listed above preferred· Good interpersonal skills to communicate effectively with multiple teams across countries"
834efd047e413058e51c93b0d69947fc,Head of Product Design ,"About the Role We are looking for the head of product design to join our ranks to help us shape the future of fintech in Indonesia and be the fairest financial services company in the region. As a product design leader, you will provide the creative vision for the company and define processes and practices to achieve this vision. You would be accountable for the overall user experience of all our products and ensure we deliver quality products to our users.What you’ll do:• You will lead the team that designs all of company’s products offerings • Work with Product and Business teams to help define the roadmap to achieve our goals and vision• Work with design leads, product heads, and engineers to build and improve user experience to help achieve   our OKRs • Build and refine the overall design process, practices, and guidelines and evangelize the same within the      organization • Partner with research and customer support teams to understand our users, their problems, and behaviors. • Define communication and collaboration principles between design and other teams• Interpret abstract business concepts and turn them into creative ideas • Partner with the marketing team to define our branding guidelines and positioning • Hiring, developing, mentoring, and inspiring the design team to constantly strive for excellence in performance • Present design plans and briefs to senior stakeholders and drive alignment• Help the organization build delightful products that our customers love What you’ll need: • At least 8 years of experience in design with a minimum of 2 years spent in leading and managing design teams • Proficiency in product design with expertise in visual hierarchy and practical knowledge of design fundamentals   like design thinking and human-centered design to build products• The knack to find solutions that satisfy business needs, the user needs, and are within the technical limitations• Ability to collaborate with cross-functional stakeholders and take a structured approach to solve problems• Experience in optimizing conversion funnels through design iterations• Expertise in working with research and data teams to make design decisions and draw insights based on    qualitative and quantitative data • High proficiency with Figma, Invision, Sketch, Adobe CC, or other similar design platforms• A deep sense of accountability, adaptability, and embracing ambiguity working in a fast-paced environment • Excellent leadership and managerial skills, demonstrated by the ability to communicate a vision and inspire and  motivate others to action"
78e02d40e45eb7bc437399cec28b179e,Account Assistant [5 Days / Joo Koon] 9156,"Account AssistantWorking days : Mon - Fri, 9am - 6pmLocation: Lok Yang Way, Jurong | SINGAPORE 628641 (near Joo Koon MRT)Salary : $2900 + $205 transport allowanceJOB PURPOSE:Responsible in rendering assistance to the Accounts Supervisor on various accounting matters.JOB DETAILS:  The job holder should be responsible for the following:  Enter PO Invoice entries  Issue Debit note to inter-company for shared services  Check Staff Expenses claims in BPM  AP Adjustment – For Contra payment  Process/Print Monthly Preformat Listing Batch Payment  Direct Debit Payment Entries  Enter AR Receipt Entries  Adjust difference between provision and actual freight charges at month end  Reclassification of Sales account codes  Send SOA to customers, Ensure prompt follow-up with customers for payments and Update Ageing Report  Perform Monthly Cash Book Revaluation in AccpacPerform Monthly Bank Reconciliation  Prepare Reports/Schedulesa) Weekly BCR Report for UKb) Monthly Actual YTD file for UKc) Monthly POR file for UKd) Monthly Other Debtors – Recoverablee) Monthly Other Creditors – Externalf) Monthly Customer Advance Paymentg) Quarterly Bad Debts Provisionh) Quarterly Provision for Excess  Obsolete stock (i) Quarterly Intercompany Email Confirmation and Update UK CR2 Reportj) Quarterly Tax Stream Reportk) Quarterly Supplementary Data Request Report)l) Quarterly Certification Filem) Quarter 4 (Jan to Mar) - Daily Sales Tracker  Provide internal  external audit support  IC Modification  Adhere to local and international trade compliance procedures in connection with all transactions and business practices  Fulfil any other reasonable duties as requiredRequirements:  GCE ‘O’ Levels or equivalent  ACCPAC and Microsoft knowledge  Experience: Minimum 3 years in accounting field  Experience in keeping partial sets of accounts📲Whatsapp 9851 1096 📩supreme.cherlylim@gmail.com  R2199156 14C7279"
668298c13adf558f0cd63c1ee894c767,7104-Assistant Finance Controller [US and Singapore GAAP | Manufacturing | Costing and Hyperion | Tuas south],"Position title : Assistant ControllerLocation: Tuas South (Company transport pick up: Jcube (Jurong East)Working Days: Mon - FridayWorking hours : 8:30am to 5:05pmSalary :  5k - 7kASSISTANT CONTROLLERThe responsibility of the Assistant Controller is to provide support to the management team (local and overseas) and ensure compliance with company and statutory policies and requirements. He/she should continuously review the current financial control system and processes and improve the efficiency of the same where appropriate.JOB RESPONSIBILITIES:o Provide leadership in managing finance team and work closely with U.S office to meet all statutory and corporate deadlines.o Support Management and staff in financial areas and work with cross-functional teams.o Forecasting and annual budget/planning, including analysis and upload to Hyperion.o Manage daily finance operations, which includes but not limited to General Ledger, General Journals, Accounts Receivables and Accounts Payables.o Preparation of periodic (monthly/quarterly/annual) financial reports and analysis for management reporting and statutory purposes.This includes reconciliations, intercompany confirmations, accounts schedules, uploading to Hyperion, analysis of financial results (cost variance analysis).o Fixed assets, cash flow and working capital management.o Ensure compliance and liaise with Government  Statutory Board requirements, auditors, SOX and Corporate  Accounting policies.o All duties within the Finance  HR/Admin function and any assignment from management.QUALIFICATIONS/EXPERIENCE REQUIREMENT• Degree in Accountancy or equivalent• 5 years experience in a supervisory role in manufacturing environment• Familiar with US and Singapore GAAP• Experience in Costing and Hyperion will be an advantage.• Strong analytical and communication skills• Able to work independently with strong sense of commitment to meeting deadlines• Only Singapore citizens/ Singapore Permanent Residents need apply."
