uuid,title,description
b45ff26cf259b4f5e714b0da4a01968b,Assistant Project Manager(Application),"Roles And Responsibilitie  Maintaining the relevant product roadmap with supporting policy or business drivers  Manage feature prioritisation discussions with key stakeholders  Development from features and concepts to functional requirements  Management of cost estimation and funding request documents  Assess proposed solutions and functional designs to validate that requirements and change requirements are met  Development of appropriate Use Cases to inform and validate requirements  Development of Requirements Traceability and monitoring of requirements fulfilment  Work with cross-functional teams in business, product, design, and engineering  Management or review of deliverables such as Product Roadmap, Functional Requirement Specifications, Funding Papers, Business Process Models, Use Cases, User Interface designs.Requirements / Qualifications  At least 5 to 8 years’ experience in the Public Service or Healthcare industry;  Self-motivated, driven, a good team player and strong ability to multi-task;  Excellent verbal, written communication and interpersonal skills; and  Relevant Project Management or ITIL Service Management certifications will be an advantage"
b2e834a46a87924030f6a70ad6a763c1,"Assistant Vice President, Business Process Management (BPM) Technology Lead","Mitsubishi UFJ Financial Group, Inc. (MUFG) is one of the world’s leading financial groups. Headquartered in Tokyo and with over 360 years of history, MUFG has a global network with over 2,700 locations in more than 50 markets. The Group has over 180,000 employees and offers services including commercial banking, trust banking, securities, credit cards, consumer finance, asset management, and leasing.The Group aims to “be the world’s most trusted financial group” through close collaboration among our operating companies and flexibly respond to all of the financial needs of our customers, serving society, and fostering shared and sustainable growth for a better world. MUFG’s shares trade on the Tokyo, Nagoya, and New York stock exchanges.MUFG Bank, Ltd. is Japan’s premier bank, with a global network spanning more than 50 markets. Outside of Japan, the bank offers an extensive scope of commercial and investment banking products and services to businesses, governments and individuals worldwide.For more information, visit https://www.mufg.jp/english.Job Scope / DescriptionWe are seeking highly motivated candidates for the position of Business Process Management (BPM) Technology Lead within Information Technology Department under Systems Office for Asia.This individual will be a key member of the team who will be responsible for formulating solutions to business  technical requirements, and architecting solutions based on the delivery schedule. He/she will lead the team to design blueprint which serves as baseline of project delivery and continual systems maintainability, guiding the team through the implementation (from design to deployment), and defining the specific solution, business, functional and non-functional requirements.  Understanding the business operating and IT solution strategy, identifying necessary IT capabilities to support business opportunities and technology implementation  Defining the solution processes  business and functional requirements, undertaking POC needed to validate the feasibility and realize the implementation  Working with other technical experts to explore and define how the systems interface/integration can be seamlessly achieved and fit into the overall solution architecture  Reviewing deliverables within the scope of the initiatives  Working closely with the business architect and IT partner to verify that the outcomes and detailed requirements are aligned  Familiar with the evolvement of BPM technologies (such as PEGA) and functionalities which should be adopted as out-of-the-box, advising users in the proper use of BPM features and options  Responsible for the Enterprise Class Structure and the overall application design, providing clear guidance on development best-practices, performing regular code and design reviews, coaching project team members  Taking commitment to continuously improve the BPM Platform. Conduct analysis of systems logs/alert effectively, provide timely resolution of incidents and mitigation of potential risks/tuning opportunities, execute counter measure as well as improvement plans  Making plan and taking charge of activities for better productivities and efficiencies including DevOps implementation, execution of automation in testing and deployments  Any other tasks or initiatives as deemed important to the operating of BPM Platform and the applications hosted on the platformJob Requirement  Minimum 10 years of IT working experience in end-to-end SDLC cycle from requirement gathering, analysis, design, testing and implementation  At least 5-7 years of hands-on experience in architecting and designing BPM solutions (e.g. PEGA) using PEGA Systems' PEGA Rules Process Commander (PRPC 7.x and newer versions)  Knowledge and experience in Banking domain.  Post-project support experience to identify and continue to enhance systems performance and values is essential  Experiences in Agile approach for implementation is added advantage.  Developed and demonstrated an advanced hands-on knowledge of the PRPC Architecture and all PRPC design and implementation features  Certified in PEGA Senior System Architect (SSA) / Certified Lead System Architect (CLSA)  Strong in communication verbally and in writing  Self-motivated and possess drive, and ability to work independently and a good team playerWe regret to inform that only shortlisted applicants will be notified Job ID:  10048363-WDRecruiter Name: Natalie Tan EA License No: 12C5536 EA Registration No: R1106672"
2b4e1a78c3ef7fc8b4efead3c39c6e37,Assistant Head / Senior Officer (Planning and Policy) (Up to $6200/West),"Job Title: Assistant Head / Senior Officer (Planning and Policy)Job Type:  3 year ContractJob Location: WestOur Client:Our client is a leading nurture and foster a spirit of community and volunteerism that promotes the virtue of placing others before self. By organising initiatives such as RI-led community involvement activities, outreach programmes and fundraising events, we strengthen our relationships with our people, youths and community partners to build a better world for all.The Human Development Group in the Singapore Institute of Clinical Sciences (SICS) conducts research on developmental cohorts as well as related studies in nutrition, metabolism, allergy and neurocognition. The successful candidate will provide dietetics and research support to a diet and exercise intervention study on diabetes.Job Responsibilities:  Directs and undertakes mission-oriented research to transform Singapore into a knowledge-based and innovation-driven economy. As the think-tank, the Planning and Policy Division (PPD) coordinates strategic planning and corporate planning activities, and is the key interface with senior management and other public sector agencies on policy matters within and beyond  We are looking for a passionate and motivated individual with a keen policy sense and strong analytical abilities, who can think strategically to chart future RD directions and yet be grounded in the details of quantitative data analysis.  You will play a key role in planning strategic directions, co-ordinating division- and nation-wide RD issues, as well as gathering intelligence on current RD challenges and future requirements applicable to Singapore’s RD landscape. You will also organise and participate in various corporate events. You will have ample opportunities to interact with senior management directly, and with a range of government agencies, including at the senior levels.  You are expected to develop a deep understanding of RD policy and its wider impact on Singapore, being closely intertwined with various facets of policy making such as healthcare, education, manpower and economic development.Job Requirements:  Experience, preferably in the science and/or engineering field  Possess strong strategic and analytical thinking skills  Pro-active, quality conscious, attentive to details and results-oriented  Able to deliver results under tight timelines  High learning agility and adaptability  Able to work in a team and adept at harnessing the diversity in multi-disciplinary and cross-functional teams  Proficient in Microsoft Office suite  Good communication (written and verbal) and interpersonal skills  Strong negotiation skills  Relevant working experience in the public sector, strategic and/or corporate      planning, would be an advantageIf interested, please share your updated CV in word format at willie.zhong@rmagroup.com.sg  stating your salary expectations to take it forward.To expedite processing, you can lodge your application directly athttps://www.rmaconsultants.com.sg/employment/registerjobseeker.aspxorhttps://bit.ly/expeditejobapplWillie ZhongRMA Consultants Pte LtdEA License No. 93C4403EA Regn. No. R1986471"
50eda78cdb80efc4918d4b96d34895b9,Sales Associate (Tiong Bahru)-7914,"Whatsapp +65 86938995 (Rouis) or  Email: supreme.yaprouis@gmail.comJob Scope :  Scope: Supports Sales Manager in achieving annual sales targets.  Servicing interior designers, architects, contractors  developers  and secure local project sales. (Regional project sales is a secondary channel)  Servicing existing  establishing new clientele base for the company.  Executing sales  coordinating marketing activities in support of organisational sales campaign.  Supporting in-house retail sales department."
869a9ead9866998501da1916bf72765c,Account Assistant [5 days/ JOO KOON] (JQ),"Working days : Mon - Fri, 9am - 6pmLocation: Lok Yang Way, Jurong (near Joo Koon MRT)Salary : $2900 + $205 transport allowanceJOB PURPOSE:Responsible in rendering assistance to the Accounts Supervisor on various accounting matters.JOB DETAILS:  The job holder should be responsible for the following:  Enter PO Invoice entries  Issue Debit note to inter-company for shared services  Check Staff Expenses claims in BPM  AP Adjustment – For Contra payment  Process/Print Monthly Preformat Listing Batch Payment  Direct Debit Payment Entries  Enter AR Receipt Entries  Adjust difference between provision and actual freight charges at month end  Reclassification of Sales account codes  Send SOA to customers, Ensure prompt follow-up with customers for payments and Update Ageing Report  Perform Monthly Cash Book Revaluation in AccpacPerform Monthly Bank Reconciliation  Prepare Reports/Schedulesa) Weekly BCR Report for UKb) Monthly Actual YTD file for UKc) Monthly POR file for UKd) Monthly Other Debtors – Recoverablee) Monthly Other Creditors – Externalf) Monthly Customer Advance Paymentg) Quarterly Bad Debts Provisionh) Quarterly Provision for Excess  Obsolete stock (i) Quarterly Intercompany Email Confirmation and Update UK CR2 Reportj) Quarterly Tax Stream Reportk) Quarterly Supplementary Data Request Report)l) Quarterly Certification Filem) Quarter 4 (Jan to Mar) - Daily Sales Tracker  Provide internal  external audit support  IC Modification  Adhere to local and international trade compliance procedures in connection with all transactions and business practices  Fulfil any other reasonable duties as requiredRequirements:  GCE ‘O’ Levels or equivalent  ACCPAC and Microsoft knowledge  Experience: Minimum 3 years in accounting field  Experience in keeping partial sets of accounts"
d24d6f2460397c1fe9657900835cd46b,Credit Associate,"Position Description  ResponsibilitiesWe are now seeking for an Associate with the Credit team, based in Singapore. The individual will be involved with all aspects of the Credit investment process, including but not limited to:· Performing credit investment analysis of a broad range of companies and industries;· Financial statement analysis and financial modeling of portfolio companies and potential investment opportunities;· Assistance in development of actionable private credit transactions up and down the capital structure;· Preparation of investment committee materials, conducting due diligence on assets, presenting ideas to investment committee;· Analysis of deal terms and covenant structures;· Sourcing and evaluating potential investments;· Performing due diligence and execution of transactions;· Overseeing reporting and monitoring of investments in conjunction with the Portfolio Management Unit;· and interacting with the firm’s investors, clients and limited partners.The incumbent will interact closely with other KKR businesses such as the Client and Partner Group, Private Equity, KKR Capstone, KKR Capital Markets etc.QualificationsA candidate must embody KKR’s core values, in particular:· unquestioned integrity,· a strong work ethic,· and a commitment to teamwork and excellence.The ideal candidate will have a genuine enthusiasm and curiosity for investing; a strong understanding of fundamental business analysis; possess an outstanding academic record; and 3 - 7 years of professional experience, preferably in a leading investment bank, private equity firm, or consulting practice.  The candidate must possess superior analytical and financial modeling skills; a solid grasp of financial concepts; exceptional written, interpersonal, and communication skills; attention to detail; and a maturity that enables the candidate to contribute to a collaborative and constructive work environment.  It is essential for a candidate to be a self-starter and motivated, with the ability to multi-task, prioritize, and work both independently and within teams."
eef4adf849a9158b203f9c7e7c8f2ce8,0382 - Software Engineer [Pasir Panjang/ Entry],"Responsibilities:  System Administration and Installation of UNIX/LINUX/WINDOWS Servers  Workstations  Software Configuration Management using Rational Clear Case and RCS  Basic Network Setup (routers, switchers, IP addresses)  Database Modeling and Parameterization (Oracle)  Scripting using Java Scripts, Perl, ksh, csh, bsh, bash  Software Development using C, C++, Pascal, SQL, Java, HTML, XML, etc  Functional and Integration Testing  Site Commissioning of delivered SCADA/'DMS/EMS systems  Warranty support and maintenance for delivered projectsRequirements:  Degree in Computer Science/Computer Engineering  Training provided"
eab2f87ee917dd48ce5466767d5674a6,Director of Project Management | Data Centre Construction ,"Permanent Full-Time role  Fast growing companyAbout Our ClientMy client is one of the fastest-growing data centre providers globally, headquartered in Singapore. The company has grown rapidly organically and through investments in market-leading businesses.Job DescriptionTo provide effective project management, planning and control of assigned large sale project(s) including:  Champion the project to zero harm and compliance to corporate and project EHS requirements  Provide strategic input, experience and expertise to organise, set-up and expedite the project for success  Establish and maintain overall project delivery plan, including the cost, schedule, quality and performance baseline  Establish and maintain communication protocols across the project, including from internal departments and other stakeholders  Manage project budget and costs, including the change management process  Manage project schedule, including critical path analysis and work around planning  Manage the bid and evaluation or required project consultants and contractors, including coordinating required management approvals  Administer contracts, including maintaining strict compliance with the contract, scope of work and compliance with project specifications  Coordinate owners' requirements and inputs to the project, including compliance with end user requirements  Coordinate authority, third party and stakeholder interfaces such as Project Approvals and Power Supply Connection  Communicate and report internally on project status, including weekly and monthly project dashboards  Identify, analyse and mitigate project risks and champion project opportunities  Manage the delivery/transition of the projects to DC Operation teamsThe Successful Applicant  Bachelor/ Masters preferably in a relevant construction or engineering discipline  Project Management qualification or similar equivalent training in the Engineering and Construction industry  Minimum 20 years industry experience with more than 10 years Project Management experience for Data Center and other related Mission Critical (24x7) environment projects  Project Management Experience with a minimum project value of $300m.  Experience should include multiple countries across Asia, with demonstrated engagement at all project levels.  Experienced in full-lifecycle Project Management from design and feasibility through to close-out and DLP  Possess experience in owners side project delivery.What's on OfferOur client is offering a competitive salary with full benefits. We are looking for an experienced professional who has a strategic mindset, who is seeking a long-term career move."
d7876528dfe4a2e89c9026b5f83f9e54,"Assistant Manager, Learning Technology and Systems","About UsSingapore University of Social Sciences (SUSS) is a university with a rich heritage in inspiring lifelong education, and transforming society through social sciences. As one of Singapore's six autonomous universities, we champion inclusivity, bringing education to all regardless of age, qualification, experience and background; ensuring that lifelong learners are given equal opportunities to develop to their fullest potential.The Institute for Adult Learning (IAL), as part of SUSS, leads in the field of research on adult learning to build capabilities of the training and adult education (TAE) sector in Singapore and beyond.Grounded in our core philosophy of Head, Heart, Habit (3H), we take pride in our people’s success by provide them with a fulfilling career through purposely work that make a difference in our graduates journey, and investing in their professional development to bringing out the best in them.About RoleWe invite applications from committed professionals to join the Learning Technology and Systems team of IAL and enhance the quality of administration by providing reliable support solutions. The successful candidate will support and implement Institute for Adult Learning's efforts to manage the design, development and implementation of an application platform to support (i) the building capability and career development of Training and Adult Education (TAE) practitioners and (ii) provide the system to support the business processes for One-Stop Skills Credentialing and Adult Education Network.Your primary areas of responsibilities include:  Manage the design and development project to support the end-to-end business processes for One-Stop Skills Credentialing and Adult Education Network, Adult Educators' Professionalisation, TAE professional profiling and Jobs-skills insights. TAELENT is a talent platform to be used by Adult Educators in Singapore to profile their skills, look for jobs and assignments, look for suitable upskilling programmes and opportunities, interact with the adult educator community, and get recognition from IAL and SkillsFuture Singapore.  Manage the translation of  TAELENT business and user requirements into technical specifications for the development of the system.  Establish a system to provide good user experience to drive up number of active users of the platform.  Establish intuitive system function to support digital badging process to drive the issuance and adoption of skills badges.  Develop data dashboard and perform data analysis for TAE skills and job demand/supply.  Establish an eco-system to support TAE professionals in seeking job opportunities and projects through the TAELENT Platform.  Manage project budget and payment to system vendor for development and maintenance.  Manage the integration of  TAELENT platform to other systems, to ensure all milestones and tasks are well-planned and coordinated, supporting organisation IT masterplan.  Support any other corporate events or projects that may require assistance from time to time.Job Requirements:  Tertiary qualification in Information Technology, Computer Science, or Computer Engineering  preferably with at least 5-8 years of relevant business analyst working experience for full design/development and implementation/maintenance of enterprise-level system  Familiarity with the training and adult education sector is preferred.  Strong technical knowledge in application development (with full SDLC methodologies such as Waterfall, Agile, SCRUM etc.), programming languages (.NET, ASP.NET, Java, J2EE, Spring, HTML5, JS, CSS) and Cloud services (Microsoft Azure, Amazon Web Services or other cloud service providers) with experience in the operation of cloud architecture and related.  Formal training and qualifications in these technical areas is preferred.  Excellent communication and interpersonal skills to manage all stakeholders at all levels for project discussions, updates and recommendations.  Proven project, resource and change management skills to handle the work demands and deliver high quality work within the given timelines.  Strong acumen in problem solving, critical thinking, logical/analytical, and process improvement  skills.  High learning agility, be able to work under time pressure, and be highly adaptable to thrive in a fast-paced, fast-changing environment.  An entrepreneurial spirit to do things better, be open to possibilities, and be able to navigate technical, political, and organisational roadblocks that can emerge."
8bc1e4904d05b53772684ac8f0078cf5,PR Executive ,"Responsibilities:· Define and develop the brand strategy for the company’s various brand· Drive growth (in guest visitation and spend metrics) and mind share through the marketing levers· To support the media and marketing communications effort and initiatives across all relevant marketing channels· Ensure a consistent best in class holistic brand experience for guests- on-line, offline, and translating into brand love and loyalty· Collaborate with teams to determine and ensure product, services and experiences deliver innovation and guest journeys within the voice of the brand· Present data and analytics reports through and research  insights to determine the consumer research roadmap and own relevant brand audits/trackings· Planning and execution of the PR and communications plan, including media pitches, corporate events, web launches, livestreams etc.· Create content for press kits, including press releases.· Handle and maintain close relationships with both digital and traditional media, social media KOLs and agency partners.· Plan, implement and evaluate effectiveness of campaigns and promotions.Requirements:· A Diploma in Business, Marketing, Communications or relevant· Strong copy-writing skills (both Mandarin and English is a MUST)· Proven ability to manage budgets.· Experience with PR, Branding and digital marketing· Competency in Microsoft applications including PowerPoint, Word, Excel, and Outlook."
00b51a5ed6a5accd739fb406fc151c29,Assistant Manager (Policy & Governance),"Roles and Responsibilities1. Coordinate with stakeholders to comply with policies, standards and procedures.2. Conduct regular reviews such as user access rights reviews, audit logs reviews, etc.3. Support management in responding effectively to internal and external auditors.4. Address the audit recommendations by working with responsible parties and mitigate risks identified.5. Monitor the implementation status of audit recommendations.6. Collate IT risks from incidents, make recommendations and prepare reports.7. Create and update standard operating procedures, work instructions, etc.8. Keep abreast of new industry trends and best practices relating to governance, risk and compliance.Requirements / Qualifications1. Tertiary qualifications in Computer Science, Information Technology or related degree/diploma.2. Professional certifications on IT audit, risk or security from ISACA or (ISC)2 would be advantageous.Position Summary / Project Description: 1. Compliance to HealthTech Instruction Manual (HIM). HIM will gradually grow from 3 to 22chapters.2. Coordinate new audit projects in the Internal Audit Plan. Some of the upcoming auditprojects are VPN and Work-From-Home Policy, Review of Privileged Access Controls(Application Systems), Follow-up Review of Central Clinical Data Repository (CCDR), ITDisaster Recovery Review, etc.3. Management reporting on IT Resiliency Top Risk for TTSH Quality Council (QC)"
d27a33f31d3c07dcd6293417b1c53c5b,Delivery Driver (Class 3) [5.5 Days / Jurong port] 9156,"Delivery Driver (Class 3)$1, 800 to $2, 2005.5 days, 9am-6pm, 9am-1pmJurong Port Road, Jurong Logistics Hub, S619115Responsibilities:  Delivery and collection of alcoholic products  Delivery to households and industry outletsRequirements:  Possess Class 3 driving license  At least two years' driving experience  Familiarity with alcoholic beverage products preferred  Number of Vacancies: 2  Min Qualification GCE 'N' Level📲Whatsapp 9851 1096 📩supreme.cherlylim@gmail.com  R2199156 14C7279"
