uuid,title,description
aee788fb10eecd9a240ab89d17a89f6b,Software Engineer [App development/ C#/ .NET/ 5 days/ Sin Ming] (JQ),"Working hours: 5 days, 9am-6pmWorking Location:Sin Ming AveJob Responsibilities:-Design, develop, Test and maintain both new and existing code, ranging from client-side development using JavaScript, HTML, and CSS, to server-side code using C# and ASP.NET MVC, Web API, Windows services, and ADO.NET for data persistence and retrieval. Xamarin for Mobile Development.-Write readable, extensible, testable code, while being mindful of performance requirements.-Create, maintain, and run unit tests for both new and existing code, with a goal of delivering defect-free and well-tested code to QA.-Work with management to create and adhere to schedules, while maintaining flexibility to adapt to shifting market demands.-Translate mockups and wireframes into functioning front-end code.-Write and maintain documentation for new and existing features.-Keep up-to-date on best practices and new technologies.-Rapid prototyping, and presenting conceptual design and working prototypes to management.-Conduct design and code reviews and collaborate to ensure your own code passes review.-Work with Product Management to analyze requirements.-Collaborate on technical architecture and design.Job Requirements:-Degree in Computer Science or Related Field.-Minimum 2 years of Experience-Solid understanding of OOP design principles-Visual Studio 20XX, SQL Server 20XX-Remote debugging-Unit TestingFront-end-C#, ASP.NET MVC, Web API-JavaScript, jQuery, AJAX-HTML5, CSS3, Responsive Design-Understanding of web technology stack, including HTTP, REST, cookies, caching, and asset loadingBack-end-Windows  web services, WCF, MSMQ, Signal-R-C# and .NET Framework-Experience with scalable, performant design and architectureDatabase-Working knowledge of SQL and relational databases-Should be able to read and write basic SQL queries, stored procedures, views, and functions-ADO.NET  LINQ to SQLMobile DevelopmentXamarin"
47d9768e4fe57ff5192b7674ddd7e375,Investment Banking Officer - Compliance ,"Exciting opportunity to join one of the top global banks in the world  Interact with high networth clientsAbout Our ClientOur Client is one of the world's top global banks with over 20,000 branches world wide with a strong foothold in Asia.Job DescriptionThe role of Investment Banking Officer, will be to assist the Compliance Manager in ensuring that KYC/AML tasks are completed in a timely and accurate manner on top of BAU activities. Reporting to the Compliance Manager, your duties will be as follows:  Perform in depth KYC/AML checks on account opening and client on-boarding process in compliance to AML regulations, monitor FI counterparties for sanctions news  Partner Client, Business Support and service providers to ensure timely transaction processing and service delivery of clients' requirements  Create, update and maintain FI counterparty ID and account as part of onboarding process;  Assist RMs and external FI to identify cross-selling opportunities and increase number of successful outward referrals to other parts of the Group, as well as to identify credit needs of clients.  Perform credit risk assessment of FI counterparties periodically;  Other relevant tasks assigned by the department head and team head.The Successful Applicant  Bachelor's Degree in Banking and Finance or Commerce or equivalent qualifications  At least 1 year of working experience in the banking industry within investment banking space  Basic knowledge of corporate banking, investment banking, trade finance and treasury products;  Highly motivated team player with excellent communication and interpersonal skills;  Keen interest in China's capital markets products/servicesWhat's on Offer  Attractive opportunity to join one of the top global banks with over 20,000 branches  Interact with High Net Worth Individuals from across the region"
d80855ddc65fe521edd38b882817f750,Senior  IT Audit,"You will be responsible for planning and executing IT audits for the Companie. You will also assist the Singapore Chief Internal Auditor, Group Internal Audit, to provide an independent and objective assurance to improve the Group’s IT control environment.You are self-motivated, a good team player with initiative, who is keen to explore a career switch opportunity and willing to be challenged. We are open to candidates with experience in IT Security/Operations, application development and career auditors to discuss this opportunity.he Job  Participate or lead in the planning and execution of audit assignments to ensure quality and timeliness of reports and deliverables;  Develop risk-based audit plans and testing programs;  Ensure coverage of relevant regulatory requirements and recommend improvements to corporate policies, procedures and practices to enhance IT control design and enforcement;  Support business audits through integrated or thematic audits by providing technology expertise and evaluating IT controls supporting the business operations;  Manage or participate in other ad-hoc assignments including special projects and investigations;  Contribute to continuous monitoring of technology risk areas. Establish and maintain strong relationship with technology stakeholders including risk management and control groups;  Assist in the follow-up with auditees on outstanding audit findings through the issuance of Audit Tracking Report and verification of resolved findings;  Ensure that audit operating standards and procedures are observed, and requirements of the Quality Assurance Review are met; and  Takes accountability in considering business and regulatory compliance risks and takes appropriate steps to mitigate the risks.  Maintains awareness of industry trends on regulatory compliance, emerging threats and technologies in order to understand the risk and better safeguard the company.  Highlights any potential observations /risks and proactively shares best risk management practices.Our Requirements  5 - 7 years of relevant experience in IT security governance, IT Infrastructure/Cybersecurity/outsourcing operations, Technology Risk Management in banking or FI;  Knowledge or exposure to cybersecurity controls, infrastructure technology (i.e. cloud security, network, virtualization), ethnical hacking, application security, API, micro services and secure coding standards;  Familiar with the regulatory requirements specific to technology risk management (e.g. MAS, RMiT, OJK);  Good report writing, communication and presentation skills;  Complete audit work papers and reports with minimal intervention by the audit manager/team lead;  Provide continuous monitoring of technology areas, engage technology control partners to upkeep with the changing IT risk landscape of the group;  Attention to details to ensure completeness and accuracy of audit coverage;  Strong analytical skill, time management, independent and collaborative;  Able to interact well with all levels of staff;  Bachelor's degree in Computer Science or Engineering, Accounting, preferably hold one or more of these professional certifications (e.g. CISA, CISM, CEH, CISSP, CCSP);  High level of integrity, takes accountability of work and good attitude over teamwork;  Takes initiative to improve current state of things and adaptable to embrace new changes.  Self-motivated and takes initiative to improve current state of things and adaptable to embrace new changes; and  Able to travel overseas when required and safe to do so (10% estimated).PERSOLKELLY Singapore Pte Ltd • RCB No. 200007268EEA License No. 01C4394 • EA Registration No. R1113321 (Jacob Tijo)"
53f259bb65e03867829a40ef8ea52bf1,Electrical Design Officer (MNC / 5 days / fresh grads welcome) ,"Company’s profileJulian Grey’s client is a well-established elevator engineering Japanese MNC with 50 years’ presence in Singapore. The company is established globally  looking for passionate  dedicated Electrical Designers to join their rapidly expanding team.Fresh graduates welcome to apply. Training will be provided.Work from home arrangement.Working hours: Mon - Fri, 8.30am – 5.45pmJob Responsibilities  Check and review technical aspects of project design  Design, make amendments, update and issue drawings for elevator parts and installations  Carry out project design review to ensure customer specifications are met  Implement design improvements where necessaryRequirements  Educational qualification in Electrical Engineering or equivalent  Proficient in MS Office  AutoCad  Able to work independently  Good communication skills in English and problem solver  Fresh grads welcome to apply, training will be providedFollow us for more updates, interview tips!https://www.instagram.com/juliangreygroup/https://www.linkedin.com/company/juliangreygroup/https://www.facebook.com/juliangreygroup/Our telegram channel for job opportunities - https://t.me/jobopportunitiessgCassie ChanReg No. 2197426Julian Grey Corporate Advisory Pte. Ltd.EA License No: 19C9568"
5ab4621ff9e6c1d82e4170c99841e16a,‼️Bubble Tea Food Beverage Assistant F&B‼️,"Bubble Tea Assistants (FB)Vacancy Open: Hiring Full Time Bubble Tea AssistantsScope  Duties: Cashier Duty/Making Beverages/Light FryingCommitment: 6 Days Work Week (1 Weekday Rest)Salary: Negotiable Based On ExperienceNoteBy Sending Any Application To Us, You Will Have Deemed To Have Consented To Us Collecting, Using, Retaining And Disclosing Your Personal Information To Prospective Employers For Their ConsiderationTo Apply Or Enquire: Whatsapp To Joe At 97231002Joe ChewRecruitment ExpressEA License: 20C0178EA Personnel No: R2093776"
91e1c81bf9c44184c023f95b417889f1,Mechanical Supervisor,"RESPONSIBILITIES   Provides mechanical integrity and inspection support for fixed equipment and piping during pre-comm and commissioning of the expansion plant as well as base plant support where required  Provides QA/QC support for pre-comm and commissioning of the expansion plant, including review of ITP and NDT reports  Supervise and provide oversight to activities performed by mechanical contractors  Supports the review of preventive maintenance instructions/intervals and spare parts strategy for operational readiness of the expansion plant  Provides oversight on Quality Assurance for work done in the TA, maintenance and projects  Provide sound recommendations on findings to ensure safe and reliable plant operations  Ensures all static equipment works are covered by procedures, Work instructions and QA/QC checklists and ITP compliance to applicable codes, standards and specification. Audits the QA/QC process and quality of reports/documentation  Supports the improvement and implementation of the site inspection and defect elimination strategy such as preventive maintenance and RBI  Provides technical support for NDT activitiesKNOWLEDGE, SKILLS AND EXPERIENCE REQUIRED  Diploma in Mechanical Engineering or equivalent  10 years’ experience in Refinery and Petrochemical process technical environment Prior  Experience in inspection and QA/QC of Projects, Plant Commissioning, Asset Integrity, Turnarounds and Maintenance Execution is essential.  Understand Operations, Maintenance and engineering practices.  Understand common petrochemical standards such as ASME and API  Possess relevant ASNT/PCN and API certifications  Knowledge in CMMS systems  Good communication skills and internal / external stakeholder management"
33be07dd605b01620b019694e14e7ad1,Vice President & Chief Managing Officer ,"DUTIESNippon Express (South Asia  Oceania) PTE. LTD.Vice President  Chief Managing Officer, Head of Regional Corporate Strategy HeadquartersROLE  RESPONSIBILITIES  As the Vice President  Chief Managing Officer, be in charge of making any decisions and executing operations for all matters related to corporate management, including the determination of business plan and organization structure plan, executing capital matters, managing internal control and finance and accounting, and making decisions in human resource for entire South Asia and Oceania region.  Regional Corporate Strategy Headquarters covers the following departments: Administration, Finance and Accounting, Human Resources Strategy, Risk Management,  Information System, Safety and Quality Promotion, Mekong Development Centre.  South Asia and Oceania bloc consist of 27 companies and 3 branches (in Singapore, Malaysia, Thailand, Philippines, Vietnam, Indonesia, Cambodia, Myanmar, Laos, India, Bangladesh, Pakistan, Sri Lanka, Australia, New Zealand).MINIMUM REQUIREMENTSEducation  Bachelor's Degree or above.Technical Skills and Prior Experience  At least 20 years of experience in forwarding and logistics.  Demonstrable experience in developing strategic and business plans.  Thorough knowledge of market changes and forces that influence the company  Familiarity with corporate law and management best practices  Excellent organisational and leadership skills  Excellent communication, interpersonal, and presentation skills  Outstanding analytical and problem-solving abilitiesThe ideal candidate must:  Strong verbal and written communication skills.  Strong interpersonal, supervisory, team player and customer service skills required.  Possess attributes of respectfulness, honesty, integrity and flexibility  Ability to multi-task, work under pressure and meet deadlines required"
f84b45470499d8c290b19168e441b316,0382 - Account executive [1 year contract renewable / Redhill / 5 days],"Location: Bukit Merah  Working Days: 5 days / Mon - Fri  Working hours : 9AM - 6PM or 8.30a.m-5.30 p.m  Salary : Up to $3,200 (Depending on the experience)The main responsibilities include:  Producing timely and accurate financial statements and management reports for four partner accounts  Maintain accounting records and ensure finance processes comply with policies and statutory requirements. This includes ensuring supporting schedules are up to date and accurate and issues arising are resolved promptly  Maintain full set of accounts for Partners, monitor and keep our company management abreast of  Partners’ financial performance and cash-flow  Opportunities to lead or participate in process improvement projects or new systems implementation projects  Other ad hoc duties that may be assigned from time to timeTechnical Competencies:  Possess a recognized Diploma in Finance or Accountancy   Good working knowledge of CAS is a plus  With at least 2 years of accounting work experience, prior VWO will be advantageous   Proficient in Microsoft Office applications (especially MS Excel)  SAGE 300 knowledge is an advantage"
db76fc030e18ba280ba09f228e72597f,"Technical Lead, C environment","· Contribute to projects for Antaes clients· Design and develop IT systems· Solve high complexity business cases; using modern technologies like microservices, containers, dev-ops best practices· Create/refine technical design and system architecture depending on project/application context· Manage various constraints while envisioning solutions for various project needs· Study project needs and propose solutions while working with  project managers, business and operational teams, business analysts and  developers· Deliver high quality fully tested code according to specifications· Maintain and manage CI/CD tooling; ensure high quality end to end monitoring· Address various technical aspects of projects/information systems with architect and functional aspects with business analyst· Align application architectural and technological decisions to enterprise architecture roadmap· Liaise with business teams for clarification and understanding of requirements· Provide detailed estimation and technical documentation of solutions· Develop tests strategy in coordination with project manager / Business Analysts· Follow the user acceptance test and coordinate the prioritization with project manager· Mentor and coach other junior developers on technical aspects· Support applications in production - analyze and resolve issues as they arise· Contribute to the promotion of Antaes services on top of assistance provided to clientJob Requirements:· Minimum Bachelor’s Degree or equivalent experience required· At least 10+ years of development experience in one or several of the following languages C, Java, Python, Golang, Node.Js.· Strong curious mindset with lifelong learner approach· Experience in designing and delivering green field project· Experience in converting monolith to Microservices is preferred· Experience in technologies: Elasticsearch / Kibana / logstash, any one messaging system like MQ, Kafka is preferred· Experience in Docker, Kubernetes or involvement in containerization projects is preferred· Experience in handling Support and BAU activities is an advantage· Domain knowledge in payments and cash management is an advantageTechnical:· Strong understanding of coding principals is required.· Strong knowledge in Object-Orientated (OO) design and Design patterns is a must.· Strong knowledge of distributed systems· Good Understanding of Memory management in non-garbage collected environments.· Good Debugging skills and familiarity with C-language tools like GDB, Lint, Valgrind, etc.· Proficient Understanding of code versioning tools (such as GIT, SVN).· Good Understanding with Web Servers (such as Apache web server, cgi).Operational skills:· Strong analytical and problem-solving skill· Must have good interpersonal and communication skills· Analysis methods and languages such as UML· Able to work in a fast pace, high pressure environment with high sense of urgency· Accountable and has strong ownership of work· Presentation skills to execute Tech Talks is an advantage"
00494f5668bb112d37f3ffd191458b44,Sales Executive,"Job Description:1. Achieve the sales target and other key performance indicators relating to marketing2. Conduct sales calls, sales presentations, negotiate and prepare sales proposals and tender/quotation3. Seek and identify business opportunities from Media, Gebiz  business networking4. Attend tender briefings on behalf of company5. Handle clarifications from clients regarding tender etc6. Maintaining fruitful relationships with existing customers and support them after salesJob Requirement:1. Need to be “hunters” and ambitious to clinch sales2. Team player and resourceful to seek opportunities3. Possess at least a Diploma or certifications in sales/marketing4. Proven sales track record in professional selling5. Knowledge of Microsoft Office6. Excellent spoken  written English7. Fresh graduates can be considered as training is provided"
7986c432784cbb829c8f92b9cdbd414b,Senior QA CSV Engineer,"Responsibilities:  Will be required to prepare the quality review and ensure all approvals of qualification/validation documentation, and relevant data for conformance to regulations, Standard Operating Procedures (SOPs), specifications and other applicable acceptance criteria.  Provide overall quality oversight for key functional areas mainly for CSV but may also include (QC, Supply Chain, Engineering) ensuring that programs, policies and procedures are in compliance with regulatory and client expectations.  Perform all activities in compliance with client safety standards and SOPs  Participate in other projects/duties as assigned.Qualifications:  Bachelor degree in Chemical Engineering or related discipline preferred.  At least 7 years’ experience in relevant fieldExperience:  Experience in change control, non-conformance, corrective and preventative actions, and validation practices.  Experience working in a pharmaceuticals industry or similar GMP environment as part of an engineering, technical services or operations function or other combination of experience and educational background that may otherwise satisfy the requirements of the role  Experience working in Quality Assurance role in a GMP Life Science environment.  Knowledge of Computerised System Validation.  Experience with Delta V"
7c5d300a592600245c02302561d1e926,Sales Executive,Job Description1. Handle customer enquiries and provide quotation timely.2. Handle phone calls and emails from potential clients.3. Attend to walk-in customers.4. Follow up on outstanding quotations that are not converted to sales      orders. 5. Resolve customers’ issues.6. Work closely with project coordinator regarding delivery and schedule of jobs.7. Make appointments and visit potential customers for new business8. Prepare quotation and conduct site visit and measurement if any. 9. Do Sales presentation to prospective clients.10.Any other ad-hoc duties as assigned by the Management.Job Requirements· Minimum 2 years of of relevant experience in indoor or outdoor sales.· Ability to read and interpret technical documents and drawings will be   an added value. · Knowledge of sheet gym/rubber/vinly flooring fabrication or related   industry will be preferred.· Strong customer skills and attention to details.· Team player who possess strong communication and analytical skills.· Provicient in Microsoft suite and computer skills.Salary and job title commensurate according to relevance of work experience and qualification. Candidates with more experience will be considered for Senior Sales Executive.We regret to inform that only shortlisted candidates would be notified.
8765575e473edafd8f228e1ba1e2c224,Material Scheduler [E&E/ 5 days/ Kaki bukit] (JQ),"5 days Monday - Friday 8:30am -5:30pmWorking Location: Kaki BukitJob Responsibilities:• Collaborate with regional sales, Product Managers and Supplier Management in the developmentof a demand forecast updated weekly• Monitor component real time availability across all products, current stock, EOL, obsolescence• Identify and validate alternative sources of supply/franchised distributors locally.• Identify and arrange meetings with OEM component manufactures with Supplier manager.• Provide and update information relating to supply threats and opportunities.• Recommend purchase of strategic materials purchases to manage supply risk• Report and distribute EOL/Obsolescence/Last Time buy to Supplier Manager and Developmentteams. Follow up to ensure appropriate action has been taken• Interface with Supplier Manager, Development and Suppliers to resolve material supply issues.Job Requirements:• Diploma in Electronic/ Electrical/ Procurement• At least 1 year of relevant experience  expereince• Materials planning• Clear and effective communication with both internal and external departments.• Negotiation skills.• Excellent communication skills and team player• Experience within manufacturing industry• Previous experience in an electronics manufacturing supply chain highly advantageous.• Take a proactive approach in dealing with material/component supply issues• Data management handling."
7105858dfe3547a4882f1b4f01276c94,OUTLET MANAGER / ASSISTANT MANAGER ,"•	Coordinate the entire restaurant operation •	Handle customer’s enquiries and complaint efficiently•	Control cost and minimize wastage•	Oversee stock level•	Deliver excellent customer service and ensure customer satisfaction•	Nurture a positive working environment and lead by example•	Able to deploy, supervise, direct and motivate staff •	Handle administrative and paper work•	Maintain good communication and interaction with different division in the company and suppliers•	Making  Confirming Guest Reservations•	Hosting Guest to their tables•	Customer Service / Waiting on guest•	Daily sales reporting /Sales settlement •	Stocktake•	Preparation, table setup and ensure proper handling of all operation equipment •	Ensure cleanliness and timely services are always rendered to guests•	Explain how various menu items are prepared, describing ingredients and cooking methods•	Ad hoc tasks assign by Management"
